id,identifier,identifier_to_certificate,description101,"Formação com Coordenadores(as) Pedagógicos(as), Vice-Diretores(as) e Diretores(as)","Formação Continuada com Coordenadores Pedagógicos, Vice-Diretores e Diretores",Apresentação dos principais conceitos que caracterizam o Projeto Eco-Político-Pedagógico  (PEPP) e Plano de Trabalho Anual (PTA) na perspectiva da Escola Cidadã.  Reflexão acerca da importância da Leitura do Mundo da escola para a ação transformadora. Reflexão sobre o papel da equipe gestora no processo de construção dos instrumentos necessários para a elaboração coletiva do Plano de Trabalho Anual. Reflexão acerca do conceito de participação e suas implicações na gestão escolar. Análise das atribuições pedagógicas e administrativas do trio gestor. Avaliação e acompanhamento do processo de construção do PTA das Unidades Educacionais. 102,Formação com Educadores(as) da Educação de Jovens e Adultos,Formação Continuada com Educadores da Educação de Jovens e Adultos,Análise do estado da arte da Educação de Jovens e Adultos (EJA) nos contextos nacional e internacional. Estudo da epistemologia e metodologia freirianas e das concepções de educação e aprendizagem. Estudo da Psicogênese da Língua Escrita e sua contribuição ao processo de Alfabetização de Adultos. Reconhecimento e classificação de diferentes hipóteses de escrita do(a) educando(a) adulto(a). Concepção de leitura e estratégias lúdicas no trabalho de leitura e escrita de textos. Análise da função social da escrita. Estudo dos gêneros textuais e dos diferentes portadores de texto. Vivência dos procedimentos metodológicos de planejamento e avaliação.103,I Encontro de Educandos e Educandas da EJA e do Mova,I Encontro de Educandos da EJA (Educação de Jovens e Adultos) e MOVA (Movimento de Alfabetização de Jovens e Adultos),"Integração dos(as) educandos(as) da EJA e do MOVA. Realização da Leitura do Mundo com os(as) educandos(as), possibilitando a escuta de seus sonhos e expectativas de futuro.  Início do processo de reorientação curricular da EJA de Osasco com discussões, debates, reflexões e perspectivas dos diferentes sujeitos que dela fazem parte. Resgate das memórias da escola nos tempos da infância e da adolescência e discussão sobre os desafios de voltar ao ambiente escolar nos tempos atuais. Análise da importância do corpo na construção da identidade, nas atividades lúdicas junto ao processo de aprendizagem escolar (oralidade, leitura e escrita),  no exercitar dos sentidos, no resgate da autoestima e na prevenção e saúde."104,Formação com Gestores(as) da Educação de Jovens e Adultos,Formação Continuada com Gestores da EJA (Educação de Jovens e Adultos),"Análise da conjuntura atual e suas implicações na Educação. Reflexão acerca dos saberes e práticas necessárias ao processo de ensinar e aprender. Estudo das diferentes técnicas do teatro-imagem que podem ser utilizadas como diagnóstico e avaliação processual. As relações humanas e o diálogo via cartas, buscando aproximar coordenador(a) e educador(a). Mapeamento das práticas presentes na coordenação pedagógica.  "105,Formação com Educadores(as) do Mova,Formação Continuada com Educadores da EJA (Educação de Jovens e Adultos) e MOVA (Movimento de Alfabetização de Jovens e Adultos),"Análise do conceito de Educação de Jovens e Adultos. Trabalho com as categorias freirianas: Círculo de Cultura, Tema Gerador, Leitura do Mundo, Relação Dialógica etc. Estudo da vida e obra de Paulo Freire e da Psicogênese da Língua Escrita. Reflexão acerca das relações teóricas entre os estudos de Paulo Freire e Emília Ferreiro, na perspectiva da construção da leitura e da escrita. Tematização da prática pedagógica. Reconhecimento da importância das histórias de vida na construção da identidade. Fortalecimento do MOVA, ressaltando os compromissos assumidos com os(as) educandos(as) e com a sociedade em geral."106,Formação com Funcionários de Apoio ,Formação Continuada com Funcionários de Apoio,Apresentação do Programa Escola Cidadã de Osasco. Escuta dos desafios e expectativas dos funcionários em relação ao seu trabalho. Reflexão acerca do papel de educador que cada funcionário(a) exerce no dia a dia das escolas. Atividades visando à promoção de maior integração entre os profissionais da Rede Municipal de Educação. 107,Formação da Reorientação Curricular da Educação Infantil com Coordenadores(as) Pedagógicos(as) e Diretores(as),Formação com Coordenadores Pedagógicos e Diretores sobre a  Reorientação Curricular da Educação Infantil,"Formação processual dos profissionais envolvidos com a educação das crianças pequenas, com vistas à elaboração/atualização de uma proposta pedagógica para a Educação Infantil municipal, que contemple a especificidade do desenvolvimento infantil, o direito das crianças à infância e a qualidade da educação para a máxima aquisição das qualidades humanas na infância. Elaboração de plano de reorganização do espaço das unidades e discussão das ideias gerais que orientam a proposta de reorganização curricular da Educação Infantil.    "108,RECEI - Deletar depois de transferir,,109,Formação com Educadores(as) do Mova,Formação Continuada com Educadores do MOVA (Movimento de Alfabetização de Jovens e Adultos),"Análise dos fatos marcantes no processo de escolarização dos(as) educadores(as) e das histórias de vida na constituição da identidade. Reflexão sobre o preconceito presente na sociedade em relação ao analfabeto. Reflexão sobre a linguagem teatral na construção da liberdade pessoal. Trabalho com a musicalidade: sensibilização, percepção, concentração e interpretação musical.  Corporeidade e musicalidade: corpo como possibilidade de criação de ritmo, sons,  tempo etc. Criação e composição musical, estabelecendo relação com o tema gerador e com a interdisciplinaridade. Estudo do conteúdo do almanaque e dos demais cadernos da coleção O formador em formação. "110,Formação com Gestores(as) da Educação de Jovens e Adultos (EJA),Formação Continuada com Gestores da EJA (Educação de Jovens e Adultos),Reflexão sobre o processo da reorientação curricular da EJA (RECEJA) e sobre o diálogo entre o ensino e a aprendizagem. Elaboração de atividades de linguagem escrita com base na RECEJA e socialização das informações sobre o trabalho desenvolvido com os(as) educadores(as).111,Formação com o Grupo de Trabalho da Avaliação 2008,Formação com o Grupo de Trabalho de Avaliação,Reflexão sobre os princípios da avaliação dialógica e sobre os indicadores gerais do Programa Escola Cidadã de Osasco. Elaboração de instrumentais para serem aplicados nas Unidades Educacionais. Análise dos resultados da avaliação e elaboração de gráficos. Formulação de sínteses a serem  apresentadas no contexto da III Conferência Municipal de Educação. Elaboração coletiva da programação da III Conferência Municipal de Educação de Osasco.  112,"***MOVER PARA: ""EJA Formação Continuada de Educadores e Gestores Educacionais da EJA · 2008",,113,***MOVER PARA: Formação Continuada de Educadores e Gestores Educacionais da EJA 2008,,114,Formação com Funcionários de Apoio ,Formação Continuada com Funcionários de Apoio,"Construção do Projeto Eco-Político-Pedagógico (PEPP) e dos princípios de convivência. Reflexão sobre o cotidiano da escola a partir da análise dos temas: merenda/alimentação; organização do espaço; organização de documentos, higiene e limpeza, pessoas e  relações na escola."115,Grupo de Trabalho da Reorientação Curricular da EJA (Receja),Formação Continuada com Grupo de Trabalho da RECEJA (Reorientação Curricular da Educação de Jovens e Adultos),"Reflexão sobre o currículo e os saberes necessários para uma educação inclusiva e sobre as tendências recentes  dos estudos e das práticas curriculares. Leitura e análise de textos sobre cultura e currículo. Elaboração, aplicação, tabulação e discussão do questionário de caracterização socioeconômica dos(as) educandos(as) da EJA. Construção coletiva do II Encontro de Educandos e Educandas. Orientação para elaboração do Projeto Eco-Político-Pedagógico na EJA. Análise e preenchimento das questões do Documento Preliminar da RECEJA e elaboração coletiva da proposta curricular da EJA."116,"Formação com Coordenadores(as) Pedagógicos(as), Vice-Diretores(as) e Diretores(as)","Formação Continuada com Coordenadores Pedagógicos, Vice-Diretores e Diretores","Análise das práticas curriculares e  a construção do currículo a partir da Leitura do Mundo, numa reflexão crítica sobre a função social do conhecimento. Organização de instrumentais para a Avaliação de Impacto do Programa Escola Cidadã de Osasco. Reflexão sobre a Festa da Escola Cidadã (FEC) e sobre a Leitura do Mundo desenvolvidas pelas Unidades Educacionais. Reflexão a respeito do papel dos(as) educadores(as) no processo de elaboração do Projeto Eco-Político-Pedagógico na perspectiva da gestão democrática e compartilhada. "117,Formação com Equipe Técnico-Pedagógica,Formação Continuada com Equipe  Técnico-Pedagógica (PEPP / PTA),Reflexão acerca dos pressupostos teórico-metodológicos da gestão educacional da Escola Cidadã. Organização de estratégias e procedimentos para o acompanhamento do Plano de Trabalho Anual pelas Unidades Educacionais. Organização e desenvolvimento da I Conferência Municipal de Educação e da Assembleia do Sistema Municipal de Educação. Orientações para acompanhamento da Leitura do Mundo das Unidades Educacionais e para a construção do Projeto Eco-Político-Pedagógico (PEPP). Análise da concepção de gestão democrática e do papel dos Conselhos de Escola visando ao acompanhamento e efetivação do processo eleitoral dos Conselhos de Gestão Compartilhada.118,Formação com o Grupo de Trabalho da Avaliação,Formação Continuada com Grupo de Trabalho de Avaliação,"Avaliação e devolutiva dos resultados gerais do Plano de Trabalho Anual (PTA) de cada Unidade Educacional. Avaliação junto aos(às) diretores(as) e coordenadores(as) do impacto do Programa Escola Cidadã de Osasco em cada Unidade Educacional, a partir da aplicação de instrumentais de avaliação."119,Palestra Sobre Educação e Direitos Humanos com Prof. Roberto da SIlva,Palestra sobre Educação e Direitos Humanos com Prof. Roberto da Silva,"Reflexão sobre as violações dos direitos humanos desde a formação da família na sociedade brasileira. Apresentação sobre concepções de família nuclear e arranjos familiares diversos.  Análise do ciclo de formação da marginalidade e a organização do aparato jurídico, policial e administrativo em torno dele. Diálogo sobre conceitos de cidadania e exclusão, com foco na violação dos direitos humanos dos excluídos socialmente. Relação entre educação de qualidade e direitos humanos. Congruência entre a luta pela qualidade da educação e a luta pelos direitos humanos. "120,II Encontro de Educandos e Educandas da EJA e do MOVA ,II Encontro de Educandos da EJA (Educação de Jovens e Adultos) e MOVA (Movimento de Alfabetização de Jovens e Adultos),"Realização de feira de artesanatos feitos pelos(as) educandos(as). Criação de estandarte representando as unidades educacionais ou núcleos do Mova. Apresentação de curtas com histórias de vida. Reflexão sobre diversidade dos sujeitos da EJA e do Mova. Apresentações culturais com artistas da região. Círculos de Cultura como espaço de  construção de princípios orientadores da nova proposta curricular do município.   Lançamento da coleção O formador em Formação, composta por cinco cadernos para formação dos(as) educadores(as) do MOVA e dos cadernos um e dois da RECEJA."121,Formação com Coordenadores(as) do Mova,Formação Continuada com Coordenadores do MOVA (Movimento de Alfabetização de Jovens e Adultos),"Análise da conjuntura atual e suas implicações na Educação. Reflexão acerca  dos saberes e práticas necessárias ao processo de ensinar e aprender. Vivência das diferentes técnicas do teatro-imagem que podem ser utilizadas como diagnóstico e avaliação processual. Socialização das informações sobre o trabalho dos(as) educadores(as). Mapeamento das práticas presentes na coordenação pedagógica, com vistas à construção dos princípios de convivência. Consolidação da aproximação entre os(as) educadores(as) e coordenadores(as) educacionais para  criação de vínculos afetivos e profissionais por meio do processo de correspondência. Fortalecimento da aproximação entre os segmentos de MOVA e EJA."122,Grupo de Trabalho da Reorientação Curricular da Educação de Jovens e Adultos ( Receja),Formação com Grupo de Trabalho da RECEJA (Reorientação Curricular da Educação de Jovens e Adultos),"Análise de algumas experiências de  reorientação curricular realizadas no Brasil. Estudo de diferentes concepções de currículo. Mapeamento das práticas político-pedagógicas desenvolvidas pelos(as) educadores(as). Reflexão sobre a prática de planejar dialogicamente. Promoção da Leitura do Mundo nas salas de EJA, de modo a problematizar e explicitar o currículo vigente. "123,Palestra sobre Políticas públicas de Educação Popular com Prof.  Gaudêncio Frigotto,Palestra de abertura de ano letivo sobre Políticas Públicas de Educação Popular com Prof. Gaudêncio Frigotto,"Reflexão sobre educação enquanto política pública. Necessidade de professores estarem contextualizados politicamente para conseguirem qualificar o processo de Leitura do Mundo, efetivando a política pública da educação como agregadora de valores a quem participa dos processos, conforme a proposta de Escola Cidadã, que conta com a participação efetiva de toda comunidade. Análise dos desafios da escola em relação ao seu conteúdo, método e forma. Problematização da Leitura do Mundo enquanto análise da realidade dos(as) alunos(as) e organização da comunidade para o desenvolvimento de ações.  "124,Palestra sobre Consciência política e profissional com Prof. Miguel Arroyo,Palestra de abertura de ano letivo sobre Consciência Política e Profissional com Prof. Miguel Arroyo,"Reflexão sobre a elaboração de proposta pedagógica significativa para a comunidade escolar. Importância da conscientização e do conhecimento crítico diante da necessidade de construção de propostas significativas que considerem o(a) aluno(a) como cidadão(ã), detentor(a) de direitos. Necessidade de reconhecer a consciência profissional política do(a) educador(a). Análise sobre a exclusão racial e econômica atrelada à violação do direito à educação. Problematização sobre a necessidade de mudar o olhar em relação aos excluídos, considerando-os em seus múltiplos papéis sociais. Educador(a) como revolucionário(a) que dá voz e reafirma os direitos aos(às) educandos(as) na escola ao trabalhar diferenças de gênero e relações étnico-raciais. "125,Formação com Equipe  Técnico-Pedagógica,Formação Continuada com Equipe  Técnico-Pedagógica (PEPP / PTA),"Discussão acerca dos três direitos das crianças nas creches: tempo de adaptação,  espaço aconchegante e tempo de brincar. Reflexão sobre a Festa da Escola Cidadã como metodologia de Leitura do Mundo. Elaboração e análise dos instrumentais do Projeto Eco-Político-Pedagógico (PEPP) e do Plano de Trabalho Atual. Sistematização do conhecimento produzido nos processos de formação da reorientação curricular da Educação de Jovens e Adultos, da Educação Infantil e dos saberes construídos para o fortalecimento da gestão democrática, do exercício da cidadania desde a infância, e do Conselho de  Gestão Compartilhada. Construção coletiva e participativa para a elaboração do PEPP, nas Unidades Educacionais. Estudo de textos e da legislação para a implementação da LEI 10.639/03 e 11.645/08."126,Formação com Coordenadores(as) do Mova,Formação Continuada com Coordenadores do MOVA (Movimento de Alfabetização de Jovens e Adultos),"Estudo do caderno cinco da coleção MOVA: Cultura matemática na alfabetização de jovens e adultos. Estudo dos conceitos de planejamento, registro e avaliação apontados no caderno seis do Mova. Análise dos fatos marcantes no processo de escolarização dos(as) educadores(as) e análise das histórias de vida na constituição da identidade.  A importância das diferentes linguagens no trabalho pedagógico. Reflexão sobre o preconceito presente na sociedade em relação ao analfabeto. Socialização das práticas em sala de aula do MOVA."